<?xml version="1.0" encoding="UTF-8" standalone="no"?>
<!DOCTYPE ddl-list SYSTEM "DataDefinition.dtd">
<ddl-list>
<ddl id="1">
<title> test1 </title>
<owner>dblab</owner>
<creation-date>1579168326196</creation-date>
<comments/>
<attribute-format type="variable">
<field-delimeter>\t</field-delimeter>
<record-delimeter>\n</record-delimeter>
<itemset is-itemset-data="false" itemset-delimeter="">
<tid-index>0</tid-index>
</itemset>
</attribute-format>
<attribute-list>
<attribute id="0">
<name>a</name>
<type>string</type>
<allow-null>false</allow-null>
<default-value/>
</attribute>
<attribute id="1">
<name>n</name>
<type>string</type>
<allow-null>false</allow-null>
<default-value/>
</attribute>
<attribute id="2">
<name>v</name>
<type>string</type>
<allow-null>false</allow-null>
<default-value/>
</attribute>
</attribute-list>
</ddl>
</ddl-list>
